{
  "version": 1,
  "id": "rust-qwen3",
  "artifactKind": "merged_model",
  "manifestVersions": [
    1
  ],
  "weightFormats": [
    "safetensors"
  ],
  "weightLayouts": [
    "single_file"
  ],
  "storedWeightDtypes": [
    "fp32"
  ],
  "modelProfiles": [
    "qwen3-0.6b-v1"
  ],
  "promptProfiles": [
    "qwen3-chat-nonthinking-v1"
  ],
  "executionProfiles": [
    {
      "device": "cuda",
      "dtype": "bf16",
      "tensorParallelSize": 1
    }
  ],
  "generationModes": [
    "greedy"
  ],
  "maxContextTokens": 2048,
  "maxOutputTokens": 512,
  "maxActiveGenerations": 1,
  "streaming": true,
  "httpContract": "qps-openai-subset-v1"
}
